Date,Time,Duration(in hours),Activity
2025-01-21, 15:00, 6   , Started the opengl.com introduction and project setup; began the transformations chapter
2025-01-22, 11:00, 4   , Finihed learnopengl.com introduction and began on the lighting section although very confused by the phong lighting model
2025-01-23, 10:00, 1.5 , Worked my way through most of the lighting section
2025-01-26, 10:00, 4   , Finished the lighting section
2025-01-26, 10:00, 4   , Started and finished the model loading section
